{
    "schemaType": "CredentialSet",
    "schemaVersion": "1.0.0",
    "name": "NAME",
    "namespace": "NAMESPACE",
    "labels": {
        "LABEL": "LABEL_VALUE"
    },
    "credentials": [
        {
            "name": "credential-path",
            "source": {
                "path": "/path/to/credential-path-file.txt"
            }
        },
        {
            "name": "credential-command",
            "source": {
                "command": "echo 'credential command'"
            }
        },
        {
            "name": "credential-env",
            "source": {
                "ENV": "CREDENTIAL_ENV"
            }
        },
        {
            "name": "credential-value",
            "source": {
                "value": "credentialvalue"
            }
        },
        {
            "name": "credential-secret",
            "source": {
                "secret": "credential-secret"
            }
        }
    ]
}